[
  {"schemaVersion": "cm.media-learning-event/v1", "eventId": "EV-001", "eventType": "PUBLIC_REACTION_CLASSIFIED", "occurredAt": "2026-08-10T00:00:00Z", "artifactRevisionSha256": "aaaaaaaaaaaaaaaaaaaaaaaaaaaaaaaaaaaaaaaaaaaaaaaaaaaaaaaaaaaaaaaa", "sourceClass": "SYNTHETIC_PROBE", "scope": {"audience": "TECHNICAL_EXPERT", "contentFamily": "verification"}, "outcome": "CONFUSION", "residualUncertainty": "No external prevalence or comprehension outcome is known.", "aggregateCount": 1, "routeReceipt": {"changed": ["planned probe now asks for mechanism recall"], "notChanged": ["factual core", "publication state"], "why": "One weak synthetic observation cannot promote a template.", "evidenceRefs": ["PROBE-001"], "owner": "editor", "reviewDate": "2026-08-20"}},
  {"schemaVersion": "cm.media-learning-event/v1", "eventId": "EV-002", "eventType": "FEEDBACK_ROUTED", "occurredAt": "2026-08-10T00:00:01Z", "artifactRevisionSha256": "bbbbbbbbbbbbbbbbbbbbbbbbbbbbbbbbbbbbbbbbbbbbbbbbbbbbbbbbbbbbbbbb", "sourceClass": "SYNTHETIC_PROBE", "scope": {"audience": "TECHNICAL_DECISION_MAKER", "contentFamily": "authority"}, "outcome": "RULE_TEST_ADDED", "residualUncertainty": "Human audience-fit review remains pending.", "aggregateCount": 1, "routeReceipt": {"changed": ["negative adaptation-drift test"], "notChanged": ["audience hypothesis confidence", "factual core"], "why": "The route is useful for a local fail-closed test but not an audience outcome claim.", "evidenceRefs": ["PROBE-002"], "owner": "editor", "reviewDate": "2026-08-20"}}
]
